Title,Author(s),Published Year,Editions,Avg. Rating,Num. of Ratings
"Python for Beginners: The Crash Course to Learn Python Programming Fast (10 Python Projects) – Learn to Artificial Intelligence, Big Data, Data Science, Machine Learning, Deep Learning",['sivakumar munusami'],0,1,3.50,4
Data Science Design Patterns,['Todd Morley'],2016,1,0.00,0
Complete Analytical Project before Data Science interview,['TheDataMonk'],0,1,4.17,6
"Python Programming: 2 books in 1: Learn Python Programming + Neural Networks for Beginners - An Easy Textbook for Getting Started with Machine Learning, ... Data Science (Artificial Intelligence 5)",['Russel R. Russo'],0,1,5.00,1
Machine Learning: 3 books in 1: - Hacking Tools for Computer + Hacking With Kali Linux + Python Programming- The ultimate beginners guide to improve your knowledge of programming and data science,['Adam Bash'],0,1,4.50,2
"Python Programming, Deep Learning: 3 Books in 1: A Complete Guide for Beginners, Python Coding for AI, Neural Networks, & Machine Learning, Data Science/Analysis with Practical Exercises for Learners",['Anthony Adams'],0,2,4.57,7
"Business Intelligence: An Essential Beginner’s Guide to BI, Big Data, Artificial Intelligence, Cybersecurity, Machine Learning, Data Science, Data Analytics, Social Media and Internet Marketing",['Richard Hurley'],0,2,3.00,1
"The Big Data Market. A Data-Driven Analysis of Companies Using Hadoop, Spark, and Data Science",['Aman Naimat'],0,1,3.20,5
"DATA SCIENCE FROM SCRATCH: Complete guide to master data process, mining, data-analytic, neural networks, machine learning in Python, Linear Algebra, Statistics, Coding, Applications Decision Tree",['G.S. Collins'],0,2,3.00,1
The Data Science Handbook,"['Carl Shan', 'Henry Wang', 'William Chen']",0,1,5.00,2
Neural Data Science: A Primer with MATLAB® and PythonTM,"['Erik Lee Nylen', 'Pascal Wallisch']",0,3,4.00,2
"Data Science from Scratch: Want to become a Data Scientist? This guide for beginners will walk you through the world of Data Science, Big Data, Machine Learning and Deep Learning",['Steve Geddis'],0,2,4.00,2
"Managing Your Data Science Projects: Learn Salesmanship, Presentation, and Maintenance of Completed Models",['Robert de Graaf'],0,2,3.00,3
"Artificial Intelligence Business Applications: How to Learn Applied Artificial Intelligence and Use Data Science for Business. Includes Data Analytics, Machine Learning for Business and Python",['Oliver Tensor'],0,2,0.00,0
Практическая статистика для специалистов Data Science [Prakticheskaya statistika dlya spetsialistov Data Science],"['Peter Bruce', 'Andrew Bruce', 'Питер Брюс']",0,8,4.05,297
"The Monk who knew Linear Regression (Python): Understand, Learn and Crack Data Science Interview",['TheDataMonk'],0,1,4.25,4
"Python for Data Analysis: A Beginner’s Guide to Learn Data Science, Programming and Machine Learning’s Tips and Tricks",['Tony Hacking'],0,2,0.00,0
"Python: 3 Books in 1 : Machine Learning, Python and Data Science. Learn Computer Programming for Beginners.",['Oliver Soranson'],0,1,4.00,2
Data Science Fundamentals,"['Lars Nielsen', 'noreen burlingame']",2013,2,4.50,2
Neural Data Science: A Primer with Matlab(r) and Python,"['Pascal Wallisch', 'Erik Lee Nylen']",0,1,4.33,3
"Data Analytics: 3 Books in 1 - The New Ultimate Bible for Understanding & Using Data Analytics, Big Data + Data Science For Business + Data Mining",['John Harper'],0,2,3.40,5
"Python Machine Learning: A Beginner’s Guide to Python Programming for Machine Learning and Deep Learning, Data Analysis, Algorithms and Data Science With Scikit Learn, TensorFlow, PyTorch and Keras",['Zach Codings'],0,2,4.14,7
Data Science From Scratch: Ultimate Guide To Master Data Mining And Data-Analytic From Linear Algebra And Statistics To Practical Examples Of Neural Networks ... In Python (Computer Networking Easy Book 2),['Ramon Base'],0,1,3.20,5
Python for R Users: A Data Science Approach,['Ajay Ohri'],0,3,3.00,5
"Data Science: A Comprehensive Guide to Data Science, Data Analytics, Data Mining, Artificial Intelligence, Machine Learning, and Big Data",['Richard Hurley'],0,2,1.00,1
PYTHON: 2 Books in 1: Python Programming & Data Science. Master Data Analysis from Scratch and Discover the Secrets of Machine Learning with Step-by-Step Exercises,['Daniel Howard'],0,1,1.00,1
"Big Data: A Complete Guide to the Basic Concepts in Data Science, Cyber Security, Analytics and Metrics",['Hans Weber'],0,2,3.60,5
Statistical Learning and Data Science,"['Mireille Gettler Summa', 'Léon Bottou', 'Bernard Goldfarb']",2011,3,3.00,2
Data Science and Analytics for Ordinary People,['Jeffrey Strickland'],2015,1,4.00,2
What Is Data Science?,['Mike Barlow'],0,1,4.33,6
Machine Learning: The Art and Science of Algorithms That Make Sense of Data,['Peter Flach'],2012,8,3.97,131
Data Scientist's Book of Quotes: Insights and Advice from Data Science Leaders and Key Influencers,['Matt Corey'],0,2,4.50,2
Understanding Big Data: A Beginners Guide to Data Science & the Business Applications,['Eileen McNulty-Holmes'],2014,1,5.00,1
Data Science with Julia,"['Paul D. McNicholas', 'Peter A. Tait']",0,5,4.00,2
Python for Beginners: The Crash Course to Learn Python Programming in 3-Days (or less). Master Artificial Intelligence for Data Science and Machine Learning + Practical Exercises,['Aaron Khan'],0,4,0.00,0
XML and Web Technologies for Data Sciences with R,"['Deborah Nolan', 'Duncan Temple Lang']",2013,1,5.00,2
Exam Ref 70-774 Perform Cloud Data Science with Azure Machine Learning,"['Ginger Grant', 'Julio Granados', 'Guillermo Fernández']",0,3,5.00,1
Mathematical Underpinnings of Analytics: Theory and Applications for Data Science in Customer-Facing Industries,['Peter Grindrod'],2014,2,3.33,3
Apache Spark for Data Science Cookbook,['Padma Priya Chitturi'],0,3,3.00,2
Simulation for Data Science with R,['Matthias Templ'],0,4,1.25,4
"Python for Data Analysis: A Step-By-Step Guide to Master the Basics of Data Science and Analysis in Python Using Pandas, Numpy And Ipython (Data Science Mastery Book 2)",['Andrew Park'],0,3,2.00,2
Deep Learning Made Easy with R: Volume II: Practical Tools for Data Science,['N.D. Lewis'],0,2,4.00,1
"The Decision Maker's Handbook to Data Science: A Guide for Non-Technical Executives, Managers, and Founders",['Stylianos Kampakis'],0,2,2.75,4
The Practice of Reproducible Research: Case Studies and Lessons from the Data-Intensive Sciences,"['Justin Kitzes', 'Daniel Turek', 'Fatma Deniz']",0,1,4.00,1
Step up for Leadership in Enterprise Data Science & Artificial Intelligence with Big Data : Illustrations with R & Python,['Shitalkumar R Sukhdeve'],0,1,4.75,4
Practical Data Science with SAP: Machine Learning Techniques for Enterprise Data,"['Greg Foss', 'Paul Modderman']",0,5,4.00,1
Python Data Science: The Complete Guide to Data Analytics + Machine Learning + Big Data Science + Pandas Python. The Easy Way to Programming,['Aaron Khan'],0,4,0.00,0
Data Science Essentials in Python: Collect - Organize - Explore - Predict - Value,['Dmitry Zinoviev'],0,1,3.00,1
Data Science Fundamentals for Python and MongoDB,['David Paper'],0,1,2.00,1
R: Bootcamp - Learn The Basics of Ruby Programming in 2 Weeks!,['David   Maxwell'],0,2,3.60,5
Analyzing Social Science Data: 50 Key Problems in Data Analysis,['David De Vaus'],2002,4,4.00,2
Data Science for Librarians,"['Yunfei Du', 'Hammad Rauf Khan']",0,2,3.50,2
"Metaprogramming in R: Advanced Statistical Programming for Data Science, Analysis and Finance",['Thomas Mailund'],0,3,5.00,2
Foundations of Data Science: A Practical Introduction to Data Science with Python,['Jonathan Dinu'],2019,1,5.00,1
"Learn Python: This Book Includes: Crash Course and Coding. A Guide to Master Python, Data Science and Analysis. Advanced Methods to Learn How to Create Codes with This Machine Learning Tool",['Eric Wall'],0,2,4.67,6
Julia for Data Science,['Anshul Joshi'],0,3,3.00,2
Preparing Data for Sharing: Guide to Social Science Data Archiving,['Data Archiving and Networked Services'],2010,2,3.75,4
Data Science and Analytics with Python,['Jesus Rogel-Salazar'],0,4,4.00,1
Data Science with Python,"['Dusty Phillips', 'Fabrizio Romano', 'Phuong Vo T H']",0,2,2.00,1
Practical Data Science: A Guide to Building the Technology Stack for Turning Data Lakes into Business Assets,['Andreas François Vermeulen'],0,1,0.00,0
Breaking Data Science Open: How Open Data Science is eating the world,"['Michele Chambers, Christine Doig, Ian Stokes-Rees']",0,1,3.00,5
"Python for Beginners: The Crash Course to Learn Programming Python Faster and Remember it Longer. Includes Exercises for Machine Learning, Data Science Analysis, and Artificial Intelligence",['Marc Matthes'],0,3,0.00,0
Machine Learning for Beginners: The Beginners Guide to Understand Artificial Intelligence Business Applications and Machine Learning for Business. Includes Deep Learning and Data Science for Business,['Oliver Tensor'],0,2,0.00,0
"PYTHON FOR DATA SCIENCE: Guide to computer programming and web coding. Learn machine learning, artificial intelligence, NumPy and Pandas packages for data analysis. Step-by-step exercises included.",['Jason Test'],0,2,4.25,4
Model-Based Clustering and Classification for Data Science: With Applications in R,"['Charles Bouveyron', 'Gilles Celeux', 'T Brendan Murphy']",0,3,4.00,1
"Data Science: 2 Books in 1: Python Programming & Python for Data Science, The Ultimate Guide to Learn Machine Learning and Predictive Analytics from Scratch with Hands-On Projects",['John Russel'],0,3,3.00,1
Introduction to Data Science: Data Analysis and Prediction Algorithms with R,['Rafael A Irizarry'],0,4,3.00,1
Data Science Strategy for Dummies,['Eugene Dubossarsky'],0,2,5.00,1
A Simple Introduction to Data Science: BOOK TWO (New Street Data Science Basics 2),['Lars Nielsen'],2015,2,3.00,7
Data Science for Transport: A Self-Study Guide with Computer Exercises,['Charles Fox'],0,2,2.67,3
Python Data Science: A Hands-on Guide Beyond the Basics,['Travis Booth'],0,2,0.00,0
Introduction to Machine Learning with Python: A Guide for Beginners in Data Science,"['Daniel Nedal', 'Peters Morgan']",0,2,3.00,1
Mastering Julia - Tackle the Contemporary Challenges of Programming and Data Science with Julia,['Malcolm Sherrington'],2015,2,2.75,8
Machine Learning and Data Science Blueprints for Finance: From Building Trading Strategies to Robo-Advisors Using Python,"['Hariom Tatsat', 'Sahil Puri', 'Brad Lookabaugh']",0,2,4.00,1
Data Science : fondamentaux et études de cas: Machine Learning avec Python et R,"['Michel Lutz', 'Eric Biernat', 'Yann LeCun']",0,1,4.20,5
"Data Analytics and Computer Hacking & Mobile Hacking 3 Bundle Manuscript: Beginners Guide to Learn Data Analytics, Predictive Analytics and Data Science ... (Hacking Freedom and Data Driven Book 7)",['Isaac D. Cody'],0,1,0.00,0
"Jupyter for Data Science: Exploratory analysis, statistical modeling, machine learning, and data visualization with Jupyter",['Dan Toomey'],0,3,2.00,2
XML and Web Technologies for Data Sciences with R,"['Deborah Nolan', 'Duncan Temple Lang']",2013,1,3.00,1
"PYTHON CRASH COURSE: A PRACTICAL BEGINNER'S GUIDE TO LEARN PYTHON IN 7 DAYS OR LESS, INTRODUCING YOU INTO THE WORLD OF DATA SCIENCE, ARTIFICIAL INTELLIGENCE ... AND MACHINE LEARNING, WITH HANDS-ON PROJECT",['Erick Thompson'],0,1,4.33,3
Projekt Perseus: data og science fiction digte,['Klaus Høeck'],1977,1,5.00,1
"Big Data For Business: Your Comprehensive Guide To Understand Data Science, Data Analytics and Data Mining To Boost More Growth and Improve Business.: Volume 2 (Data Analytics Book Series)",['Victor Finch'],0,1,2.50,2
Mothers of Data Science,"['Kate Strachnyi', 'Kristen Kehrer']",0,1,0.00,0
Practical Machine Learning - Real-World Solutions to the Challenges of Data Science,['Sunila Gollapudi'],0,2,3.00,3
A Beginner’s Guide to Getting Your First Data Science Job,['￼Springboard'],0,1,4.50,2
Coffee Break NumPy: A Simple Road to Data Science Mastery That Fits Into Your Busy Life (Coffee Break Python Book 3),"['Christian Mayer', 'Lukas Rieger', 'Zohaib Riaz']",0,2,5.00,1
Data Science Interview Questions And Answers You Must Know To Get Your Dream Job,['Alexander K. Flint'],0,1,4.00,1
Python Programming For Advanced: The Updated Advanced Guide to Master Python Programming Step by Step In A Few Days with Machine Learning and Data Science Resources (Vol. 3),['Bill Steven'],0,2,1.00,1
Analysis of Multivariate Social Science Data,"['David J. Bartholomew', 'Irini Moustaki', 'Fiona Steele']",2008,4,2.60,5
Markets with Memory: The World's First Data Science Book on the Hemp & Cannabis Industry,['Nima Veiseh'],0,3,5.00,1
Basketball Data Science: With Applications in R,"['Paola Zuccolotto', 'Marica Manisera']",0,5,3.00,1
"PYTHON PROGRAMMING: 3 BOOKS IN 1 Learn machine learning, data science and analysis with a crash course for beginners. Included coding exercises for artificial intelligence, Numpy, Pandas and Ipython.",['Jason Test'],0,2,4.33,3
Fundamentals of Data Science: Take the first Step to Become a Data Scientist,['Samuel Burns'],0,2,4.00,1
"Trader Construction Kit: Fundamental & Technical Analysis, Risk Management, Directional Trading, Spreads, Options, Quantitative Strategies, Execution, Position Management, Data Science & Programming",['Joel Rubano'],0,1,0.00,0
The Python Bible Volume 3: Data Science,['Florian Dedov'],0,2,5.00,2
Korean With Kpop: A Complete Beginners Guide to Learning Korean With Kpop backed by Data Science,['Ross Ellison'],0,2,5.00,1
R for Data Science Cookbook,"['Yu-Wei, Chiu (David Chiu)']",0,2,3.00,1
DATA SCIENCE: Simple and Effective Tips and Tricks to Learn Data Science,['Benjamin Smith'],0,1,4.00,1
The Essentials of Data Science: Knowledge Discovery Using R,['Graham J Williams'],0,3,4.00,3
Data Science: Concepts and Practice,"['Vijay Kotu', 'Bala Deshpande']",0,2,4.00,2
Practical Data Science with Hadoop and Spark: Designing and Building Effective Analytics at Scale,"['Ofer Mendelevitch', 'Casey Stella', 'Douglas Eadline']",0,2,3.67,3
Special Edition Data Science Interview Questions Solved in Python and Spark: with Deep Learning and Reinforcement Learning Bonus Questions,['Antonio Gulli'],0,1,5.00,1
"Python Data Science: from Beginner to Experts About Techniques of Data Mining, Big Data Analytics and Science, Python Programming and How to Use Them in Business",['Austin Scratch'],0,1,0.00,0
"Python for Data Science: Master Data Analysis from Scratch, with Business Analytics Tools and Step-by-Step techniques for Beginners. The Future of Machine Learning & Applied Artificial Intelligence",['Jason Callaway'],0,3,3.00,3
Data Science: 2 Books: Data Analytics For Beginners And Markov Models,['Tech World'],0,2,4.00,2
Statistics Essentials for Beginner in Data Science,"['Jay Mishra', 'AI Sciences Publishing']",0,2,0.00,0
Data Science Python: How to Work with Data with Python Programming Language. The Ultimate Guide on What you Need to Know to Work with Data Using Python. (Artificial Intelligence Book 6),['Oliver Soranson'],0,1,5.00,1
"Parallel Computing for Data Science: With Examples in R, C++ and CUDA (Chapman & Hall/CRC The R Series)",['Norman Matloff'],2015,1,3.50,2
Introduction to HPC with Mpi for Data Science,['Frank Nielsen'],2016,1,2.50,2
Python Data Science: Learn the Ethics of Coding in a Day by Taking My Classes (python for beginners Book 2),['Tim Wired'],0,2,0.00,0
Deep Learning Step by Step with Python: A Very Gentle Introduction to Deep Neural Networks for Practical Data Science,['N.D. Lewis'],0,2,3.00,1
Data Science with Microsoft SQL Server 2016,"['Buck Woody', 'Danielle Dean', 'Debraj GuhaThakurta']",0,2,4.50,4
DATA SCIENCE INTERVIEW QUESTION AND ANSWER: - 400 Data Science Questions with more than 200 Questions with solution,['GICGAC ACADEMY'],0,1,0.00,0
Managing Data Science: Effective strategies to manage data science projects and build a sustainable team,['Kirill Dubovikov'],0,2,3.50,2
"Python for Data Analysis: The Best Advanced Handbook to Master Coding, Data Science and Programming with Hands-On Projects and Techniques",['Tony Hacking'],0,2,0.00,0
Machine Learning with Python: A Step by Step Guide for Absolute Beginners to Program Artificial Intelligence with Python. Neural Networks and Data Science from Pre-Processing to Deep Learning,['MARK CODING'],0,1,0.00,0
Leading a Data Driven Organization: A Practical Guide to Transforming Yourself and Your Organization to Win the Data Science Revolution,['Gordon Summers'],0,2,3.50,2
"Machine Learning for Beginners: A Beginner's Guide to Start Out Your Journey With Data Science, Artificial Intelligence, ML and its Algorithms, Deep Learning and Neural Networks From Scratch",['Jason Knox'],0,1,5.00,1
Business Analytics: The Science of Data-Driven Decision Making,['U Dinesh Kumar'],0,1,4.07,28
Exploring Data Science,"['John Mount', 'Nina Zumel', 'Robert I. Kabacoff']",0,1,4.00,1
Data Science Live Book,['Pablo Casas'],0,2,4.14,7
"The Guide to Getting a High Paying Quant Job: Quant Trading, Data Science",['Alexander David'],0,1,5.00,1
"Applied Data Science with Python and Jupyter: Use powerful industry-standard tools to unlock new, actionable insights from your data",['Alex Galea'],0,2,3.50,2
Data Science Programming All-In-One for Dummies,"['John Paul Mueller', 'Luca Massaron']",0,3,0.00,0
Evidence-Based Climate Science: Data opposing CO2 emissions as the primary source of global warming,['Don Easterbrook'],2011,3,0.00,0
MACHINE LEARNING FOR BEGINNERS: A Comprehensive Guide To Algorithms For Machine Learning And Data Science,['William J. Ford'],0,1,4.00,1
Effective Conservation Science: Data Not Dogma,['Peter Kareiva'],0,2,4.00,4
Data Science and Predictive Analytics: Biomedical and Health Applications using R,['Ivo D. Dinov'],0,1,4.00,1
"python crash course: The advanced language of technology. Python programming for AI, data analysis, data science, big data. An intermediate crash course to achieve the best results with automation",['James Taylor'],0,1,0.00,0
"PYTHON: 2 BOOKS in 1: Learn the art of computer programming with the most complete crash course for data science. Master as a pro machine learning, applied artificial intelligence & Arduino in 7 days",['Jason Test'],0,1,5.00,3
Web and Network Data Science: Modeling Techniques in Predictive Analytics,['Thomas W. Miller Jr.'],2014,2,4.00,1
"Python Data Science Essentials: A practitioner’s guide covering essential data science principles, tools, and techniques, 3rd Edition","['Luca Massaron', 'Alberto Boschetti']",0,1,5.00,1
Practical Data Science Cookbook - Second Edition,['Prabhanjan Narayanachar Tattar'],0,3,3.00,1
"Python Machine Learning: The Ultimate Guide for Beginners to Machine Learning with Python, Programming and Deep Learning, Artificial Intelligence, Neural Networks, and Data Science",['Richard Moore'],0,3,0.00,0
"R Data Science Quick Reference: A Pocket Guide to APIs, Libraries, and Packages",['Thomas Mailund'],0,1,4.50,2
"Python Machine Learning: Programming and deep learning for beginners the crash course for python programming,neural networks,artificial intelligence and data science",['Leonard Smith'],0,2,0.00,0
A tu per tu col Machine Learning: L’incredibile viaggio di un developer nel favoloso mondo della Data Science,['Alessandro Cucci'],0,1,5.00,1
Java for Data Science,"['Richard Reese', 'Jennifer L. Reese']",0,3,4.00,2
"python programming for beginners: The simplified beginner’s guide to learn basics Python computer language, coding project, data science, data analytics and learn machine learning. Exercises inside.",['Matthew Python'],0,1,3.50,2
The Digital Cell: Cell Biology as A Data Science,['Stephen J. Royle'],0,1,0.00,0
Analytical Skills for AI and Data Science: Building Skills for an AI-Driven Enterprise,['Daniel Vaughan'],0,1,2.00,1
Marketing Data Science: Modeling Techniques In Predictive Analytics With R And Python,['Thomas W. Miller'],0,1,3.50,2
Data Science with Python: Combine Python with machine learning principles to discover hidden patterns in raw data,"['Rohan Chopra', 'Aaron England', 'Mohamed Noordeen Alaudeen']",0,2,2.00,1
"Functional Programming in R: Advanced Statistical Programming for Data Science, Analysis and Finance",['Thomas Mailund'],0,2,5.00,1
Automated Time Series Forecasting Made Easy with R: An intuitive Step by Step Introduction for Data Science,['N.D. Lewis'],0,2,3.50,2
"Data Analytics and Linux Operating System 2 Bundle Manuscript. Beginners Guide to Learn Data Analytics, Predictive Analytics and Data Science with Linux ... (Hacking Freedom and Data Driven Book 9)",['Isaac D. Cody'],0,1,0.00,0
Data Science Foundations Tools and Techniques: Core Skills for Quantitative Analysis with R and Git,['Michael Freeman'],0,1,5.00,1
"What do they ask in Top Data Science Interview Part 2: Amazon, Accenture, Sapient, Deloitte, and BookMyShow","['TheDataMonk', 'The DataMonk']",0,1,4.00,2
Dark Data & Dark Social: The Promising Problem Children of Big Data and Data Science (New Street Data Science Basics Book 4),['Lars Nielsen'],0,1,3.00,4
Quantitative Social Science Data with R: An Introduction,['Brian J Fogarty'],0,4,4.00,1
PYTHON FOR DATA SCIENCE: The Practical Beginner's Guide to Learn Python Data Science in One Day Step-By-Step (#2020 updated version | Effective Computer Programming),['Steve Tudor'],0,2,4.00,1
The Essentials of Data Science: Knowledge Discovery Using R (Chapman & Hall/CRC The R Series),['Graham J. Williams'],0,1,0.00,0
"Business Intelligence: The Ultimate Guide to BI, Artificial Intelligence, Machine Learning, Big Data, Cybersecurity, Data Science, and Predictive Analytics",['Richard Hurley'],0,1,4.50,2
"Programming for Data Science: 4 Books in 1. The Complete Beginners Guide you Can’t Miss to Master the Era of the Data Economy, using Python, Java, SQL Coding",['Erick Thompson'],0,1,4.75,4
Building Data Science Teams: Finding and Organizing the Right People,['Paco Nathan'],0,1,0.00,0
"The Educational Leader's Guide to Improvement Science: Data, Design and Cases for Reflection","['Robert Crow', 'Brandi Nicole Hinnant-Crawford', 'Dean T. Spaulding']",0,1,5.00,1
"Data Science con Python: dalle stringhe al machine learning, le tecniche essenziali per lavorare sui dati",['Dmitry Zinoviev'],0,1,3.50,2
Data Science from Scratch: Intermediate guide for learning Data science and master it like a pro,['Samuel Harris'],0,1,2.33,3
Latest Designing and Implementing a Data Science Solution on Azure (DP-100) Exam Questions and Answers,['Eloic Dumps'],0,1,4.00,2
R Graphics Essentials for Great Data Visualization: +200 Practical Examples You Want to Know for Data Science,['Alboukadel Kassambara'],0,1,5.00,2
"Parallel Computing for Data Science: With Examples in R, C++ and Cuda",['Norman Matloff'],0,2,4.67,3
"Data Analytics For Businesses 2019: How to Master Data Science with Optimized Marketing Strategies using Data Mining Algorithms, Big Data for Business and Machine Learning",['Edward Brown'],0,2,3.00,1
Python Data Science: The Ultimate and Complete Guide for Beginners to Master Data Science with Python Step By Step (Data Science Mastery Book 3),['Andrew Park'],0,3,0.00,0
SPSS Essentials: Managing and Analyzing Social Sciences Data,['John T. Kulas'],2008,2,3.50,2
Data Science: Main Principles,['Nicholas Brown'],0,1,3.50,4
Practical Data Science for Information Professionals,['David Stuart'],0,1,4.00,1
PYTHON FOR DATA SCIENCE: The Ultimate Beginners’ Guide to Learning Python Data Science Step by Step,['Mr Ethan Williams'],0,1,0.00,0
"Python for Data Science: The Ultimate Beginners’ Guide to Data Science, Predictive Analytics, Statistics, and Machine Learning",['Zed Fast'],0,2,0.00,0
97 Things About Ethics Everyone in Data Science Should Know: Collective Wisdom from the Experts,['Bill Franks'],0,1,2.00,1
"PYTHON FOR DATA ANALYSIS: A PRACTICAL GUIDE YOU CAN’T MISS TO MASTER DATA USING PYTHON. KEY TOOLS FOR DATA SCIENCE, INTRODUCING YOU INTO DATA MANIPULATION, DATA VISUALIZATION, MACHINE LEARNING.",['Erick Thompson'],0,1,4.50,4
100 Python Questions to crack Data Science/Analyst Interview,['TheDataMonk'],0,1,3.00,1
Data Science for Business,['William Jayden'],0,1,0.00,0
"Python For Data Science: The Ultimate Guide to Learn Data Analysis, Visualization and Mining with Pandas, NumPy, IPython and Scikit-Learn",['Mark Graph'],0,2,0.00,0
Big Data Science in Finance,"['Irene Aldridge', 'M Avellaneda']",0,3,0.00,0
Analysis of Longitudinal Data (Oxford Statistical Science Series Book 25),"['Peter J. Diggle', 'Patrick Heagerty', 'Kung-Yee Liang']",1994,6,4.18,17
Frontiers in Data Science,"['Matthias Dehmer', 'Frank Emmert-Streib']",0,4,0.00,0
Statistics (The Easier Way) With R: An informal text on applied statistics and data science,['N M Radziwill'],0,1,4.00,2
Quantitative Analysis for System Applications: Data Science and Analytics Tools and Techniques,['Daniel McGrath'],0,1,4.50,2
Practical DataOps: Delivering Agile Data Science at Scale,['Harvinder Atwal'],0,1,5.00,1
"Python for Data Science: how to learn basic contents to work with data with this programming language with this beginner’s guide. Machine learning tools, concepts, and data analysis crash course.",['Matthew Arduino'],0,1,0.00,0
Clark's Tables Science Data Book,['Oliver & Boyd'],0,1,3.00,1
"Machine Learning for Signal Processing: Data Science, Algorithms, and Computational Statistics",['Max A Little'],0,3,0.00,0
"Python Programming: The Crash Course for Python Projects – Learn the Secrets of Machine Learning, Data Science Analysis and Artificial Intelligence. Introduction to Deep Learning for Beginners",['sivakumar munusami'],0,1,0.00,0
"Machine Learning Programming: 2 Books in 1: Machine Learning for Beginners, Machine Learning Mathematics. An Introduction Guide to Understand Data Science Through the Business Application",['Samuel Hack'],0,1,5.00,1
